[
  {
    "id": "leather_cap",
    "display_name": "Leather Cap",
    "description": "Better than nothing on your head.",
    "category": "armor",
    "subcategory": "helmet",
    "asset_key": "armor/leather_cap",
    "rarity": 0,
    "max_stack": 1,
    "level_requirement": 1,
    "is_tradeable": true,
    "stats": { "attack": 0, "defense": 3, "speed": 0, "hp": 0 },
    "equip_slot": "head",
    "base_value": 15
  },
  {
    "id": "leather_tunic",
    "display_name": "Leather Tunic",
    "description": "Tanned hide stitched into basic body armor.",
    "category": "armor",
    "subcategory": "body",
    "asset_key": "armor/leather_tunic",
    "rarity": 0,
    "max_stack": 1,
    "level_requirement": 1,
    "is_tradeable": true,
    "stats": { "attack": 0, "defense": 5, "speed": 0, "hp": 0 },
    "equip_slot": "body",
    "base_value": 25
  },
  {
    "id": "leather_boots",
    "display_name": "Leather Boots",
    "description": "Keeps your feet dry and slightly protected.",
    "category": "armor",
    "subcategory": "boots",
    "asset_key": "armor/leather_boots",
    "rarity": 0,
    "max_stack": 1,
    "level_requirement": 1,
    "is_tradeable": true,
    "stats": { "attack": 0, "defense": 2, "speed": 1, "hp": 0 },
    "equip_slot": "feet",
    "base_value": 12
  },
  {
    "id": "wooden_shield",
    "display_name": "Wooden Shield",
    "description": "A round shield of banded oak.",
    "category": "armor",
    "subcategory": "shield",
    "asset_key": "armor/wooden_shield",
    "rarity": 0,
    "max_stack": 1,
    "level_requirement": 1,
    "is_tradeable": true,
    "stats": { "attack": 0, "defense": 6, "speed": -1, "hp": 5 },
    "equip_slot": "off_hand",
    "base_value": 20
  },
  {
    "id": "iron_helmet",
    "display_name": "Iron Helmet",
    "description": "Sturdy iron plating to protect your head.",
    "category": "armor",
    "subcategory": "helmet",
    "asset_key": "armor/iron_helmet",
    "rarity": 1,
    "max_stack": 1,
    "level_requirement": 10,
    "is_tradeable": true,
    "stats": { "attack": 0, "defense": 8, "speed": 0, "hp": 5 },
    "equip_slot": "head",
    "base_value": 85
  }
]
