[
  {
    "id": "bronze_sword",
    "display_name": "Bronze Sword",
    "description": "A simple but sturdy blade. Every adventurer starts somewhere.",
    "category": "weapon",
    "subcategory": "sword",
    "asset_key": "weapons/bronze_sword",
    "rarity": 0,
    "max_stack": 1,
    "level_requirement": 1,
    "is_tradeable": true,
    "stats": { "attack": 5, "defense": 0, "speed": 0, "hp": 0 },
    "equip_slot": "main_hand",
    "base_value": 25
  },
  {
    "id": "bronze_axe",
    "display_name": "Bronze Axe",
    "description": "Useful for both combat and woodcutting.",
    "category": "weapon",
    "subcategory": "axe",
    "asset_key": "weapons/bronze_axe",
    "rarity": 0,
    "max_stack": 1,
    "level_requirement": 1,
    "is_tradeable": true,
    "stats": { "attack": 7, "defense": 0, "speed": -1, "hp": 0 },
    "equip_slot": "main_hand",
    "base_value": 30
  },
  {
    "id": "iron_sword",
    "display_name": "Iron Sword",
    "description": "Forged from iron ore. A noticeable step up from bronze.",
    "category": "weapon",
    "subcategory": "sword",
    "asset_key": "weapons/iron_sword",
    "rarity": 1,
    "max_stack": 1,
    "level_requirement": 10,
    "is_tradeable": true,
    "stats": { "attack": 12, "defense": 0, "speed": 0, "hp": 0 },
    "equip_slot": "main_hand",
    "base_value": 120
  },
  {
    "id": "iron_axe",
    "display_name": "Iron Axe",
    "description": "Heavier and sharper than its bronze counterpart.",
    "category": "weapon",
    "subcategory": "axe",
    "asset_key": "weapons/iron_axe",
    "rarity": 1,
    "max_stack": 1,
    "level_requirement": 10,
    "is_tradeable": true,
    "stats": { "attack": 15, "defense": 0, "speed": -1, "hp": 0 },
    "equip_slot": "main_hand",
    "base_value": 140
  },
  {
    "id": "steel_sword",
    "display_name": "Steel Sword",
    "description": "An alloy blade tempered to hold a fine edge.",
    "category": "weapon",
    "subcategory": "sword",
    "asset_key": "weapons/steel_sword",
    "rarity": 1,
    "max_stack": 1,
    "level_requirement": 20,
    "is_tradeable": true,
    "stats": { "attack": 22, "defense": 0, "speed": 0, "hp": 0 },
    "equip_slot": "main_hand",
    "base_value": 350
  }
]
