[
  {
    "id": "copper_ore",
    "display_name": "Copper Ore",
    "description": "Raw copper. Smelt with tin to make bronze.",
    "category": "material",
    "subcategory": "ore",
    "asset_key": "materials/copper_ore",
    "rarity": 0,
    "max_stack": 100,
    "level_requirement": 0,
    "is_tradeable": true,
    "stats": {},
    "equip_slot": "none",
    "base_value": 2
  },
  {
    "id": "tin_ore",
    "display_name": "Tin Ore",
    "description": "Raw tin. Combine with copper to make bronze.",
    "category": "material",
    "subcategory": "ore",
    "asset_key": "materials/tin_ore",
    "rarity": 0,
    "max_stack": 100,
    "level_requirement": 0,
    "is_tradeable": true,
    "stats": {},
    "equip_slot": "none",
    "base_value": 2
  },
  {
    "id": "iron_ore",
    "display_name": "Iron Ore",
    "description": "Heavier than copper, yields stronger metal.",
    "category": "material",
    "subcategory": "ore",
    "asset_key": "materials/iron_ore",
    "rarity": 0,
    "max_stack": 100,
    "level_requirement": 0,
    "is_tradeable": true,
    "stats": {},
    "equip_slot": "none",
    "base_value": 8
  },
  {
    "id": "oak_log",
    "display_name": "Oak Log",
    "description": "A sturdy log of oak wood.",
    "category": "material",
    "subcategory": "wood",
    "asset_key": "materials/oak_log",
    "rarity": 0,
    "max_stack": 100,
    "level_requirement": 0,
    "is_tradeable": true,
    "stats": {},
    "equip_slot": "none",
    "base_value": 3
  },
  {
    "id": "bronze_bar",
    "display_name": "Bronze Bar",
    "description": "An alloy of copper and tin, ready for smithing.",
    "category": "material",
    "subcategory": "bar",
    "asset_key": "materials/bronze_bar",
    "rarity": 0,
    "max_stack": 100,
    "level_requirement": 0,
    "is_tradeable": true,
    "stats": {},
    "equip_slot": "none",
    "base_value": 8
  },
  {
    "id": "gold_coin",
    "display_name": "Gold",
    "description": "The universal currency of Aetheria.",
    "category": "material",
    "subcategory": "currency",
    "asset_key": "materials/gold_coin",
    "rarity": 0,
    "max_stack": 2147483647,
    "level_requirement": 0,
    "is_tradeable": true,
    "stats": {},
    "equip_slot": "none",
    "base_value": 1
  }
]
